{
  "name": "label",
  "type": "components:ui",
  "dependencies": [
    "@radix-ui/react-slot",
    "class-variance-authority"
  ],
  "registryDependencies": [],
  "files": [
    {
      "path": "components/ui/label.tsx",
      "content": "import { Slot } from \"@radix-ui/react-slot\";\nimport { cva, VariantProps } from \"class-variance-authority\";\nimport React, { ComponentProps, ForwardRefExoticComponent } from \"react\";\n\nconst label_cva = cva(\n  [\n    \"inline-flex gap-1 text-txt-black-700\",\n    \"group-disabled:text-txt-black-disabled group-disabled:cursor-not-allowed group-disabled:shadow-none\",\n    \"peer-disabled:text-txt-black-disabled peer-disabled:cursor-not-allowed peer-disabled:shadow-none\",\n  ],\n  {\n    variants: {\n      size: {\n        small: \"text-body-sm\",\n        medium: \"text-body-md\",\n        large: \"text-body-lg\",\n      },\n    },\n    defaultVariants: {\n      size: \"medium\",\n    },\n  },\n);\n\ninterface LabelProps\n  extends ComponentProps<\"label\">,\n    VariantProps<typeof label_cva> {\n  asChild?: boolean;\n}\n\nconst Label: ForwardRefExoticComponent<LabelProps> = React.forwardRef(\n  ({ asChild, size, className, ...props }, ref) => {\n    const Comp = asChild ? Slot : \"label\";\n    return (\n      <Comp className={label_cva({ size, className })} ref={ref} {...props} />\n    );\n  },\n);\nLabel.displayName = \"Label\";\n\nexport { Label };\n",
      "type": "components:ui"
    }
  ],
  "tailwind": {
    "config": {
      "theme": {
        "extend": {
          "colors": {}
        }
      }
    }
  }
}