{
  "name": "button",
  "type": "components:ui",
  "dependencies": [
    "@radix-ui/react-slot",
    "class-variance-authority"
  ],
  "registryDependencies": [
    "utils"
  ],
  "files": [
    {
      "path": "components/ui/button.tsx",
      "content": "import React, {\n  ComponentProps,\n  createContext,\n  forwardRef,\n  ForwardRefExoticComponent,\n  ReactNode,\n  useContext,\n  LegacyRef,\n} from \"react\";\nimport { clx } from \"@/lib/utils\";\nimport { cva, VariantProps } from \"class-variance-authority\";\nimport { Slot } from \"@radix-ui/react-slot\";\n\n/*========================================================================================================================*/\n\n/**\n * Button component that supports various styles and sizes.\n *\n * @example\n * <Button variant=\"primary-fill\" size=\"medium\" onClick={() => alert('Button clicked!')}>\n *   Click Me\n * </Button>\n */\nconst button_cva = cva(\n  [\n    \"group flex select-none items-center gap-1.5 rounded-md w-fit\",\n    \"font-body font-medium outline-none transition disabled:cursor-not-allowed\",\n    \"text-center active:translate-y-[0.5px]\",\n    \"focus:ring focus:ring-fr-primary\",\n  ],\n  {\n    variants: {\n      variant: {\n        \"default-outline\": [\n          \"bg-bg-white border border-otl-gray-200 text-txt-black-700 shadow-button\",\n          \"hover:bg-bg-white-hover hover:border-otl-gray-300 hover:text-txt-black-900\",\n          \"disabled:bg-bg-white-disabled disabled:text-txt-black-disabled disabled:border-transparent\",\n        ],\n        \"default-ghost\": [\n          \"bg-transparent border border-transparent text-txt-black-700\",\n          \"hover:bg-bg-white-hover\",\n          \"disabled:bg-bg-white-disabled disabled:text-txt-black-disabled disabled:border-transparent\",\n        ],\n        \"danger-fill\": [\n          \"bg-danger-600 border border-danger-600 text-white shadow-button\",\n          \"hover:bg-danger-700\",\n          \"disabled:bg-bg-danger-disabled disabled:text-white-disabled disabled:border-bg-danger-disabled\",\n        ],\n        \"danger-outline\": [\n          \"bg-bg-white border border-otl-danger-200 text-txt-danger shadow-button\",\n          \"hover:bg-bg-danger-50\",\n          \"disabled:bg-bg-white-disabled disabled:text-txt-danger-disabled disabled:border-transparent\",\n        ],\n        \"danger-ghost\": [\n          \"bg-transparent border border-transparent text-txt-danger\",\n          \"hover:bg-bg-danger-50\",\n          \"disabled:bg-bg-white-disabled disabled:text-txt-danger-disabled disabled:border-transparent\",\n        ],\n        \"primary-fill\": [\n          \"bg-primary-600 border border-primary-600 text-white shadow-button\",\n          \"hover:bg-primary-700\",\n          \"disabled:bg-bg-primary-disabled disabled:text-white-disabled disabled:border-bg-primary-disabled\",\n        ],\n        \"primary-outline\": [\n          \"bg-bg-white border border-otl-primary-200 text-txt-primary shadow-button\",\n          \"hover:bg-bg-primary-50\",\n          \"disabled:bg-bg-white-disabled disabled:text-txt-primary-disabled disabled:border-transparent\",\n        ],\n        \"primary-ghost\": [\n          \"bg-transparent border border-transparent text-txt-primary\",\n          \"hover:bg-bg-primary-50\",\n          \"disabled:bg-bg-white-disabled disabled:text-txt-primary-disabled disabled:border-transparent\",\n        ],\n        unset: null,\n      },\n\n      size: {\n        small: \"py-1.5 px-2.5 text-body-sm\",\n        medium: \"py-2 px-3 text-body-md\",\n        large: \"py-2.5 px-4 text-body-lg\",\n      },\n\n      iconOnly: {\n        true: \"aspect-square rounded-md\",\n        false: \"\",\n      },\n    },\n    compoundVariants: [\n      {\n        iconOnly: true,\n        size: \"small\",\n        className: \"p-2\",\n      },\n      {\n        iconOnly: true,\n        size: \"medium\",\n        className: \"p-2.5\",\n      },\n      {\n        iconOnly: true,\n        size: \"large\",\n        className: \"p-3\",\n      },\n    ],\n    defaultVariants: {\n      variant: \"primary-fill\",\n      size: \"small\",\n      iconOnly: false,\n    },\n  },\n);\n\nexport interface ButtonProps\n  extends ComponentProps<\"button\">,\n    VariantProps<typeof button_cva> {\n  asChild?: boolean;\n  iconOnly?: boolean;\n}\n\nconst Button: ForwardRefExoticComponent<ButtonProps> = forwardRef(\n  (\n    {\n      className,\n      variant = \"primary-fill\",\n      size = \"small\",\n      children,\n      asChild = false,\n      iconOnly = false,\n      ...props\n    },\n    ref,\n  ) => {\n    const Comp = asChild ? Slot : \"button\";\n\n    return (\n      <ButtonContext.Provider value={{ variant, size }}>\n        <Comp\n          ref={ref}\n          className={clx(button_cva({ variant, size, className, iconOnly }))}\n          {...props}\n        >\n          {children}\n        </Comp>\n      </ButtonContext.Provider>\n    );\n  },\n);\nButton.displayName = \"Button\";\n\n/*========================================================================================================================*/\n\nconst ButtonContext = createContext<VariantProps<typeof button_cva>>({\n  variant: \"primary-fill\",\n  size: \"small\",\n  iconOnly: false,\n});\n\n/*========================================================================================================================*/\n\n/**\n * ButtonCounter component is a forward-ref exotic component that utilizes the ButtonContext\n * to apply variant and size styles to a span element.\n *\n * @param {ButtonCounterProps} props - The properties for the ButtonCounter component.\n * @param {React.Ref} ref - The ref to be forwarded to the span element.\n * @returns {JSX.Element} The rendered span element with applied styles and children.\n */\n\nconst button_counter_cva = cva(\n  [\n    \"flex aspect-square shrink-0 items-center justify-center\",\n    \"rounded-full px-1 leading-none bg-bg-primary-600 text-txt-white\",\n    \"group-disabled:bg-bg-white-disabled group-disabled:text-inherit\",\n  ],\n  {\n    variants: {\n      variant: {\n        \"primary-fill\": [\"bg-white text-primary-600\"],\n        \"danger-fill\": [\"bg-white text-danger-600\"],\n        \"default-outline\": \"\",\n        \"default-ghost\": \"\",\n        \"danger-outline\": \"\",\n        \"danger-ghost\": \"\",\n        \"primary-outline\": \"\",\n        \"primary-ghost\": \"\",\n        unset: \"\",\n      },\n      size: {\n        small: \"h-4.5 w-4.5 text-body-sm\",\n        medium: \"h-5 w-5 text-body-sm\",\n        large: \"h-6 w-6 text-base\",\n      },\n    },\n    defaultVariants: {\n      variant: \"primary-fill\",\n      size: \"small\",\n    },\n  },\n);\n\ninterface ButtonCounterProps {\n  children: ReactNode;\n  ref?: LegacyRef<HTMLSpanElement | null>;\n}\n\nconst ButtonCounter: ForwardRefExoticComponent<ButtonCounterProps> = forwardRef(\n  ({ children }, ref) => {\n    const { variant, size } = useContext(ButtonContext);\n\n    return (\n      <span ref={ref} className={clx(button_counter_cva({ variant, size }))}>\n        {children}\n      </span>\n    );\n  },\n);\n\nButtonCounter.displayName = \"ButtonCounter\";\n\n/*========================================================================================================================*/\n\n/**\n * `ButtonIcon` forwards a ref to its child and applies a class based on the button size.\n *\n * @component\n * @param {ButtonIconProps} props - The properties for the ButtonIcon component.\n * @param {React.ReactNode} props.children - The child element to which the ref will be forwarded.\n * @param {React.Ref} ref - The ref to be forwarded to the child element.\n * @returns {React.ReactElement} The cloned child element with the forwarded ref and applied class name.\n */\n\nconst button_icon_cva = cva(\n  \"block stroke-inherit text-inherit stroke-[1.5px] shrink-0\",\n  {\n    variants: {\n      size: {\n        small: \"h-4 w-4\",\n        medium: \"h-5 w-5\",\n        large: \"h-5 w-5\",\n      },\n    },\n    defaultVariants: {\n      size: \"small\",\n    },\n  },\n);\n\ninterface ButtonIconProps extends ComponentProps<\"div\"> {\n  children: React.ReactElement<any, string | React.JSXElementConstructor<any>>;\n}\n\nconst ButtonIcon: ForwardRefExoticComponent<ButtonIconProps> = forwardRef(\n  ({ children, className, ...props }, ref) => {\n    const { size } = useContext(ButtonContext);\n\n    return (\n      <Slot\n        ref={ref}\n        className={button_icon_cva({ size, className })}\n        {...props}\n      >\n        {children}\n      </Slot>\n    );\n  },\n);\n\nButtonIcon.displayName = \"ButtonIcon\";\n\nexport { Button, ButtonIcon, ButtonCounter, button_cva };\n",
      "type": "components:ui"
    }
  ],
  "tailwind": {
    "config": {
      "theme": {
        "extend": {
          "colors": {}
        }
      }
    }
  }
}