{
  "name": "announce-bar",
  "type": "components:layout",
  "dependencies": [],
  "registryDependencies": [
    "tag",
    "utils"
  ],
  "files": [
    {
      "path": "components/ui/announce-bar.tsx",
      "content": "import { ComponentProps, forwardRef, ForwardRefExoticComponent } from \"react\";\nimport { clx } from \"@/lib/utils\";\nimport { Tag } from \"./tag\";\n\n/**\n * AnnounceBar component description.\n * @component\n * @example\n * <AnnounceBar>\n *   <AnnounceBarTag variant=\"warning\">\n *     Maintenance\n *   </AnnounceBarTag>\n *   <AnnounceBarDescription>\n *     <p>This service is undergoing maintenance. Thank you for your patience. <Link *underline=\"always\" primary href=\"#\">Send us your feedback here.</Link></p>\n *   </AnnounceBarDescription>\n * </AnnounceBar>\n */\n\ninterface AnnounceBarProps extends ComponentProps<\"div\"> {\n  border?: boolean;\n}\nconst AnnounceBar: ForwardRefExoticComponent<AnnounceBarProps> = forwardRef(\n  ({ className, children, border = true, ...props }, ref) => {\n    return (\n      <div\n        ref={ref}\n        className={clx(\n          \"mx-[18px] flex flex-row gap-2 py-2 md:mx-6\",\n          border && \"border-otl-gray-200 border-b\",\n          className,\n        )}\n        {...props}\n      >\n        {children}\n      </div>\n    );\n  },\n);\n\nconst AnnounceBarTag: typeof Tag = Tag;\n\nconst AnnounceBarDescription: ForwardRefExoticComponent<ComponentProps<\"div\">> =\n  forwardRef(({ children, className, ...props }, ref) => {\n    return (\n      <div\n        ref={ref}\n        className={clx(\n          \"min-height-[28px] text-txt-black-700 font-body flex items-center text-sm\",\n          className,\n        )}\n        {...props}\n      >\n        {children}\n      </div>\n    );\n  });\n\nexport { AnnounceBar, AnnounceBarTag, AnnounceBarDescription };\n",
      "type": "components:layout"
    }
  ],
  "tailwind": {
    "config": {
      "theme": {
        "extend": {
          "colors": {}
        }
      }
    }
  }
}