{
  "name": "date-field",
  "type": "components:ui",
  "dependencies": [
    "class-variance-authority"
  ],
  "registryDependencies": [
    "calendar"
  ],
  "files": [
    {
      "path": "components/ui/date-field.tsx",
      "content": "import { ComponentProps, FunctionComponent } from \"react\";\nimport { CalendarIcon } from \"@/components/ui/icons/calendar\";\nimport { cva, VariantProps } from \"class-variance-authority\";\n\nconst datefield_container_cva = cva(\n  [\n    \"flex items-center gap-2 border rounded-md text-txt-black-900 shadow-button focus:outline-none font-body font-normal\",\n    \"focus-within:border-otl-primary-300 focus-within:ring focus-within:ring-fr-primary\",\n  ],\n  {\n    variants: {\n      size: {\n        small: \"px-[10px] py-[6px] text-sm\",\n        medium: \"px-[12px] py-[8px] text-base\",\n        large: \"px-[14px] py-[10px] text-lg\",\n      },\n      disabled: {\n        true: \"bg-bg-washed text-txt-black-500 cursor-not-allowed\",\n        false: \"bg-bg-white\",\n      },\n      invalid: {\n        true: \"border-otl-danger-300 ring-fr-danger ring\",\n        false: \"border-otl-gray-200\",\n      },\n    },\n    defaultVariants: {\n      size: \"small\",\n      disabled: false,\n    },\n  },\n);\n\nconst datefield_cva = cva([\n  \"bg-transparent focus:outline-none\",\n  \"disabled:bg-bg-washed disabled:text-txt-black-500 disabled:cursor-not-allowed\",\n  \"[&::-webkit-calendar-picker-indicator]:hidden\",\n  \"[&::-webkit-datetime-edit]:max-w-fit\",\n  \"[&::-webkit-datetime-edit-text]:mx-[2px]\",\n  \"[&::-webkit-datetime-edit-day-field:focus]:bg-primary-500 [&::-webkit-datetime-edit-day-field:focus]:text-txt-white\",\n  \"[&::-webkit-datetime-edit-month-field:focus]:bg-primary-500 [&::-webkit-datetime-edit-month-field:focus]:text-txt-white \",\n  \"[&::-webkit-datetime-edit-year-field:focus]:bg-primary-500 [&::-webkit-datetime-edit-year-field:focus]:text-txt-white\",\n]);\n\nconst icon_cva = cva([], {\n  variants: {\n    size: {\n      small: \"size-4\",\n      medium: \"size-4.5\",\n      large: \"size-5\",\n    },\n    disabled: {\n      true: \"text-txt-black-500\",\n      false: \"text-txt-black-700\",\n    },\n  },\n  defaultVariants: {\n    size: \"small\",\n    disabled: false,\n  },\n});\n\ntype DateFieldProps = Omit<ComponentProps<\"input\">, \"type\" | \"size\"> &\n  VariantProps<typeof datefield_container_cva>;\n\nconst DateField: FunctionComponent<DateFieldProps> = ({\n  className,\n  size,\n  disabled,\n  invalid,\n  ...props\n}) => {\n  return (\n    <div\n      className={datefield_container_cva({\n        size,\n        disabled,\n        invalid,\n        className,\n      })}\n    >\n      <label htmlFor=\"date-field\">\n        <CalendarIcon\n          className={icon_cva({ size, disabled })}\n          aria-label=\"Select date\"\n        />\n      </label>\n      <input\n        id=\"date-field\"\n        type=\"date\"\n        className={datefield_cva()}\n        disabled={disabled}\n        aria-invalid={invalid ?? undefined}\n        {...props}\n      />\n    </div>\n  );\n};\nDateField.displayName = \"DateField\";\n\nexport { DateField };\n",
      "type": "components:ui"
    }
  ],
  "tailwind": {
    "config": {
      "theme": {
        "extend": {
          "colors": {}
        }
      }
    }
  }
}