{
  "name": "summary-list",
  "type": "components:ui",
  "dependencies": [],
  "registryDependencies": [
    "utils"
  ],
  "files": [
    {
      "path": "components/ui/summary-list.tsx",
      "content": "import { ComponentProps, FunctionComponent } from \"react\";\nimport { clx } from \"@/lib/utils\";\n\nconst SummaryList: FunctionComponent<ComponentProps<\"div\">> = ({\n  children,\n  className,\n  ...props\n}) => (\n  <div className={clx(\"space-y-6\", className)} {...props}>\n    {children}\n  </div>\n);\n\nconst SummaryListHeader: FunctionComponent<ComponentProps<\"div\">> = ({\n  children,\n  className,\n  ...props\n}) => (\n  <h1\n    className={clx(\n      \"text-txt-black-900 text-xl font-semibold leading-[30px]\",\n      className,\n    )}\n    {...props}\n  >\n    {children}\n  </h1>\n);\n\nconst SummaryListBody: FunctionComponent<ComponentProps<\"table\">> = ({\n  children,\n  className,\n  ...props\n}) => (\n  <table\n    className={clx(\n      \"w-full text-sm font-medium\",\n      \"min-h-[40px]\",\n      \"relative\",\n      className,\n    )}\n    {...props}\n  >\n    <tbody>{children}</tbody>\n  </table>\n);\n\nconst SummaryListRow: FunctionComponent<ComponentProps<\"tr\">> = ({\n  children,\n  className,\n  ...props\n}) => (\n  <tr className={clx(\"border-otl-gray-200 border-b\", className)} {...props}>\n    {children}\n  </tr>\n);\n\nconst SummaryListTerm: FunctionComponent<ComponentProps<\"td\">> = ({\n  children,\n  className,\n  ...props\n}) => (\n  <th\n    // scope equals row here to indicate the header relates to all the row it belongs to\n    scope=\"row\"\n    className={clx(\n      \"text-txt-black-500 flex min-w-[190px] items-start py-3 pr-3\",\n      className,\n    )}\n    {...props}\n  >\n    {children}\n  </th>\n);\n\nconst SummaryListDetail: FunctionComponent<ComponentProps<\"td\">> = ({\n  children,\n  className,\n  ...props\n}) => (\n  <td\n    className={clx(\"text-txt-black-900 w-full py-3 pr-3\", className)}\n    {...props}\n  >\n    {children}\n  </td>\n);\n\nconst SummaryListAction: FunctionComponent<ComponentProps<\"td\">> = ({\n  children,\n  className,\n  ...props\n}) => (\n  <td\n    className={clx(\"flex justify-end py-1.5 pr-3 text-right\", className)}\n    {...props}\n  >\n    {children}\n  </td>\n);\n\nconst SummaryListAddition: FunctionComponent<ComponentProps<\"td\">> = ({\n  children,\n  className,\n  ...props\n}) => (\n  <td\n    className={clx(\"text-txt-black-900 min-w-36 py-2 pr-3\", className)}\n    {...props}\n  >\n    {children}\n  </td>\n);\n\nexport {\n  SummaryList,\n  SummaryListHeader,\n  SummaryListBody,\n  SummaryListRow,\n  SummaryListTerm,\n  SummaryListDetail,\n  SummaryListAction,\n  SummaryListAddition,\n};\n",
      "type": "components:ui"
    }
  ],
  "tailwind": {
    "config": {
      "theme": {
        "extend": {
          "colors": {}
        }
      }
    }
  }
}