{
  "name": "toggle",
  "type": "components:ui",
  "dependencies": [
    "@radix-ui/react-toggle",
    "class-variance-authority"
  ],
  "registryDependencies": [
    "utils"
  ],
  "files": [
    {
      "path": "components/ui/toggle.tsx",
      "content": "import React, { createContext, useContext, useId } from \"react\";\nimport { cva, type VariantProps } from \"class-variance-authority\";\nimport { clx } from \"@/lib/utils\";\n\nconst thumbVariants = cva(\n  [\n    \"block outline-none focus:ring-[3px] focus:ring-fr-primary bg-otl-gray-200 hover:bg-otl-gray-300 data-[state=checked]:bg-bg-primary-600 cursor-pointer rounded-full transition-color duration-200 z-10\",\n    \"before:content-[''] before:left-[3px] before:bottom-[3px] before:bg-white before:absolute before:rounded-full before:transition-all before:duration-200\",\n    \"peer-disabled:data-[state=checked]:bg-bg-primary-disabled peer-disabled:cursor-not-allowed peer-disabled:before:data-[state=checked]:bg-bg-white\",\n    \"peer-disabled:data-[state=unchecked]:bg-bg-washed peer-disabled:before:data-[state=unchecked]:bg-bg-white\",\n  ],\n  {\n    variants: {\n      size: {\n        small:\n          \"h-[16px] w-[24px] before:size-[10px] before:data-[state=checked]:translate-x-2\",\n        medium:\n          \"h-[20px] w-[30px] before:size-[14px] before:data-[state=checked]:translate-x-[10px]\",\n        large:\n          \"h-[24px] w-[36px] before:size-[18px] before:data-[state=checked]:translate-x-3\",\n      },\n    },\n    defaultVariants: {\n      size: \"medium\",\n    },\n  },\n);\n\ninterface ToggleContextType extends VariantProps<typeof thumbVariants> {\n  checked: boolean;\n  disabled: boolean;\n  onChange: () => void;\n  id: string;\n}\n\nconst ToggleContext = createContext<ToggleContextType | undefined>(undefined);\n\nexport interface ToggleProps extends VariantProps<typeof thumbVariants> {\n  id?: string;\n  defaultChecked?: boolean;\n  checked?: boolean;\n  onCheckedChange?: (checked: boolean) => void;\n  disabled?: boolean;\n  className?: string;\n  children: React.ReactNode;\n}\n\nconst Toggle: React.FC<ToggleProps> = ({\n  id,\n  defaultChecked = false,\n  checked,\n  onCheckedChange,\n  size = \"medium\",\n  disabled = false,\n  className = \"\",\n  children,\n}) => {\n  const [_checked, set_checked] = React.useState(\n    checked || defaultChecked || false,\n  );\n\n  React.useEffect(() => {\n    if (checked === undefined) return;\n    set_checked(checked);\n  }, [checked]);\n\n  const handleChange = () => {\n    if (disabled) return;\n\n    set_checked(!_checked);\n    onCheckedChange?.(!_checked);\n  };\n\n  return (\n    <ToggleContext.Provider\n      value={{\n        checked: _checked,\n        disabled,\n        size,\n        onChange: handleChange,\n        id: id || useId(),\n      }}\n    >\n      <div\n        tabIndex={-1}\n        className={clx(\"flex items-start justify-between gap-2.5\", className)}\n      >\n        {children}\n      </div>\n    </ToggleContext.Provider>\n  );\n};\nToggle.displayName = \"Toggle\";\n\ninterface ToggleThumbProps {\n  className?: string;\n}\n\nconst ToggleThumb: React.FC<ToggleThumbProps> = ({ className }) => {\n  const context = useContext(ToggleContext);\n  if (!context) throw new Error(\"ToggleThumb must be used within Toggle\");\n\n  //* Handles keyboard interaction: Enter | Space\n  const handleKeyDown = (event: React.KeyboardEvent<HTMLSpanElement>) => {\n    if (event.key === \"Enter\" || event.key === \" \") {\n      event.preventDefault();\n      context.onChange();\n    }\n  };\n\n  return (\n    <label tabIndex={-1} className=\"relative inline-block\">\n      <input\n        id={context.id}\n        type=\"checkbox\"\n        className=\"peer sr-only\"\n        checked={context.checked}\n        onChange={context.onChange}\n        disabled={context.disabled}\n      />\n      <span\n        tabIndex={0}\n        role=\"switch\"\n        className={clx(thumbVariants({ size: context.size }), className)}\n        onKeyDown={handleKeyDown}\n        data-state={context.checked ? \"checked\" : \"unchecked\"}\n        aria-checked={context.checked}\n        aria-disabled={context.disabled}\n        aria-label=\"Toggle\"\n      />\n    </label>\n  );\n};\nToggleThumb.displayName = \"ToggleThumb\";\n\nexport { Toggle, ToggleThumb };\n",
      "type": "components:ui"
    }
  ],
  "tailwind": {
    "config": {
      "theme": {
        "extend": {
          "colors": {}
        }
      }
    }
  }
}