{
  "name": "textarea",
  "type": "components:ui",
  "dependencies": [
    "class-variance-authority"
  ],
  "registryDependencies": [],
  "files": [
    {
      "path": "components/ui/textarea.tsx",
      "content": "import { cva, VariantProps } from \"class-variance-authority\";\nimport React, { forwardRef } from \"react\";\n\nconst text_area_cva = cva(\n  [\n    \"w-full rounded border border-otl-gray-200 bg-bg-white resize-none\",\n    \"placeholder:text-txt-black-500 text-txt-black-700 transition-colors font-body placeholder:font-body\",\n    \"focus:outline-none focus:ring focus:ring-fr-primary focus:border-otl-primary-300\",\n    \"disabled:bg-bg-washed disabled:cursor-not-allowed disabled:text-txt-black-disabled\",\n  ],\n  {\n    variants: {\n      size: {\n        small: \"min-h-[100px] p-2.5 text-body-sm placeholder:text-body-sm\",\n        medium: \"min-h-[120px] p-3 text-body-md placeholder:text-body-md\",\n        large: \"min-h-[150px] p-3.5 text-body-lg placeholder:text-body-lg\",\n      },\n    },\n    defaultVariants: {\n      size: \"medium\",\n    },\n  },\n);\n\ninterface TextAreaProps\n  extends Omit<React.TextareaHTMLAttributes<HTMLTextAreaElement>, \"size\">,\n    VariantProps<typeof text_area_cva> {}\n\nconst TextArea = forwardRef<HTMLTextAreaElement, TextAreaProps>(\n  ({ className, size, ...props }, ref) => {\n    return (\n      <textarea\n        ref={ref}\n        className={text_area_cva({ size, className })}\n        {...props}\n      />\n    );\n  },\n);\n\nTextArea.displayName = \"TextArea\";\n\nexport { TextArea };\n",
      "type": "components:ui"
    }
  ],
  "tailwind": {
    "config": {
      "theme": {
        "extend": {
          "colors": {}
        }
      }
    }
  }
}